{
  "$schema": "./labels.schema.json",
  "schemaVersion": 1,
  "organization": "hackelia-micrantha",
  "labels": [
    {"name":"priority:P0","color":"b60205","description":"Active interrupt; immediate attention required."},
    {"name":"priority:P1","color":"d93f0b","description":"Small executable next-up queue."},
    {"name":"priority:P2","color":"fbca04","description":"Planned work."},
    {"name":"priority:P3","color":"0e8a16","description":"Later, exploratory, duplicated, or uncommitted work."},
    {"name":"status:needs-grooming","color":"1d76db","description":"Outcome, scope, dependencies, or acceptance criteria need refinement."},
    {"name":"status:needs-evidence","color":"1d76db","description":"Decision or implementation claim lacks required evidence."},
    {"name":"status:needs-decision","color":"1d76db","description":"Material alternatives or authority remain unresolved."},
    {"name":"status:blocked","color":"b60205","description":"Blocked by a named unresolved dependency or condition.","aliases":["blocked"]},
    {"name":"status:ready","color":"0e8a16","description":"Sufficiently understood and unblocked for the next action."},
    {"name":"status:in-progress","color":"fbca04","description":"Actively being worked."},
    {"name":"status:needs-review","color":"5319e7","description":"Awaiting accountable review."},
    {"name":"status:needs-validation","color":"5319e7","description":"Implementation exists but required evidence is incomplete."},
    {"name":"status:deferred","color":"c5def5","description":"Valid work intentionally not scheduled."},
    {"name":"status:superseded","color":"d4c5f9","description":"Replaced by a named issue, decision, PR, or repository."},
    {"name":"type:bug","color":"d73a4a","description":"Incorrect observable behavior.","aliases":["bug"]},
    {"name":"type:feature","color":"a2eeef","description":"New user, operator, or system capability.","aliases":["enhancement"]},
    {"name":"type:delivery","color":"5319e7","description":"Bounded cross-cutting implementation, integration, migration, or refactoring outcome."},
    {"name":"type:epic","color":"5319e7","description":"Coordinates a larger outcome across bounded child work."},
    {"name":"type:spike","color":"5319e7","description":"Reduces uncertainty and produces evidence."},
    {"name":"type:design","color":"5319e7","description":"Explores or proposes architecture or system behavior."},
    {"name":"type:qart","color":"5319e7","description":"Resolves one bounded decision through alternatives and trade-offs."},
    {"name":"type:rfc","color":"5319e7","description":"Substantial proposal requiring broad review."},
    {"name":"type:adr","color":"5319e7","description":"Accepted durable decision record."},
    {"name":"type:security","color":"b60205","description":"Security vulnerability, hardening, threat analysis, or control work.","aliases":["security"]},
    {"name":"type:documentation","color":"0075ca","description":"Documentation is the primary outcome.","aliases":["documentation"]},
    {"name":"type:maintenance","color":"cfd3d7","description":"Dependency, compatibility, cleanup, or routine corrective work."},
    {"name":"type:release","color":"0e8a16","description":"Release preparation, publication, or support action.","aliases":["release"]},
    {"name":"area:architecture","color":"0052cc","description":"Architecture and system design."},
    {"name":"area:ci","color":"0052cc","description":"Continuous integration and validation."},
    {"name":"area:release","color":"0052cc","description":"Release engineering and publication."},
    {"name":"area:security","color":"0052cc","description":"Security engineering and controls."},
    {"name":"area:documentation","color":"0052cc","description":"Documentation and knowledge surfaces."},
    {"name":"area:dependencies","color":"0052cc","description":"Dependency and supply-chain maintenance."},
    {"name":"area:infrastructure","color":"0052cc","description":"Infrastructure and operational substrate."},
    {"name":"area:mobile","color":"0052cc","description":"Cross-platform mobile engineering."},
    {"name":"area:android","color":"0052cc","description":"Android-specific engineering."},
    {"name":"area:ios","color":"0052cc","description":"iOS-specific engineering."},
    {"name":"area:web","color":"0052cc","description":"Web application engineering."},
    {"name":"area:api","color":"0052cc","description":"API and service contract engineering."},
    {"name":"area:data","color":"0052cc","description":"Data storage, models, and processing."},
    {"name":"area:observability","color":"0052cc","description":"Telemetry, metrics, diagnostics, and accountability."},
    {"name":"area:governance","color":"0052cc","description":"Governance policy, authority, approval, and evidence."},
    {"name":"maturity:proposed","color":"6f42c1","description":"Proposed repository or component."},
    {"name":"maturity:experimental","color":"6f42c1","description":"Experimental and subject to significant change."},
    {"name":"maturity:incubating","color":"6f42c1","description":"Incubating toward stable contracts and operation."},
    {"name":"maturity:active","color":"6f42c1","description":"Actively developed and supported."},
    {"name":"maturity:stable","color":"6f42c1","description":"Stable and supported."},
    {"name":"maturity:maintenance","color":"6f42c1","description":"Maintenance-only lifecycle."},
    {"name":"maturity:superseded","color":"6f42c1","description":"Superseded by a named successor."},
    {"name":"maturity:archived","color":"6f42c1","description":"Archived and no longer active."}
  ],
  "repositories": [
    {
      "repository": "hackelia-micrantha/.github",
      "mode": "report-only",
      "labels": [
        "priority:P0","priority:P1","priority:P2","priority:P3",
        "status:blocked","status:ready","status:in-progress","status:needs-review","status:needs-validation",
        "type:delivery","type:epic","type:security","type:documentation","type:maintenance","type:release",
        "area:ci","area:security","area:documentation","area:governance","maturity:active"
      ],
      "notes": "Initial report-only pilot. Repository-specific labels are preserved; no apply path exists."
    }
  ]
}
